{
  "schema_version": "3.0",
  "profile_id": "c4d6e3b1-7e6f-4c5c-9f77-0f04c4f4d2b4",
  "session_id": "39664dce-f233-4fd5-a2bc-5963e70661b9",
  "attempts": [
    {
      "attempt_id": "10000000-0000-4000-8000-000000000001",
      "observed_at": "2026-10-11T12:02:00Z",
      "activity_ref": "peter-rabbit/rabbit/identify-r@1",
      "result": "correct",
      "support": "modeled_answer",
      "assessment": "teacher_confirmed"
    },
    {
      "attempt_id": "10000000-0000-4000-8000-000000000002",
      "observed_at": "2026-10-11T12:05:10Z",
      "activity_ref": "peter-rabbit/lettuce/identify-l@1",
      "result": "correct",
      "support": "none",
      "assessment": "teacher_confirmed"
    },
    {
      "attempt_id": "10000000-0000-4000-8000-000000000003",
      "observed_at": "2026-10-11T12:06:40Z",
      "activity_ref": "peter-rabbit/radish/identify-r@1",
      "result": "correct",
      "support": "none",
      "assessment": "teacher_confirmed"
    }
  ]
}
